{
    "$schema": "../TcHmiFramework/Schema/FunctionDescription.Schema.json",
    "apiVersion": 1,
    "version": {
        "full": "1.12.750.1",
        "major": 1,
        "minor": 12,
        "build": 750,
        "revision": 1
    },
    "dependencyFiles": [
        {
            "name": "CheckBindingEx.js",
            "type": "JavaScript",
            "description": ""
        }
    ],
    "function": {
        "name": "CheckBindingEx",
        "namespace": "TcHmi.Functions.Beckhoff",
        "displayName": "CheckBindingEx",
        "description": "Checks if a specific symbol is bound to a control attribute.",
        "category": "Binding",
        "returnValue": {
            "type": "tchmi:general#/definitions/Boolean",
            "description": "Result of the Access."
        },
        "arguments": [
            {
                "name": "control",
                "displayName": "control",
                "type": "tchmi:framework#/definitions/Control",
                "description": "Control",
                "required": true,
                "bindable": false,
                "restParameter": false
            },
            {
                "name": "propertyName",
                "displayName": "propertyName",
                "type": "tchmi:framework#/definitions/ControlPropertyName",
                "description": "The target attribute property name of control.",
                "required": true,
                "bindable": true,
                "restParameter": false,
                "refTo": "control"
            },
            {
                "name": "symbol",
                "displayName": "symbol",
                "type": "tchmi:framework#/definitions/Symbol",
                "description": "The target symbol.",
                "required": true,
                "bindable": true,
                "restParameter": false
            }
        ]
    }
}