{
    "$schema": "../TcHmiFramework/Schema/FunctionDescription.Schema.json",
    "apiVersion": 1,
    "version": {
        "full": "1.12.750.1",
        "major": 1,
        "minor": 12,
        "build": 750,
        "revision": 1
    },
    "dependencyFiles": [
        {
            "name": "GaugeValueFormatter.js",
            "type": "JavaScript",
            "description": ""
        }
    ],
    "function": {
        "name": "GaugeValueFormatter",
        "namespace": "TcHmi.Functions.Beckhoff",
        "displayName": "GaugeValueFormatter",
        "visible": true,
        "description": "Return a formatted string for the value passed in.",
        "category": "Formatting",
        "returnValue": {
            "type": "tchmi:general#/definitions/String"
        },
        "arguments": [
            {
                "name": "value",
                "displayName": "value",
                "type": "tchmi:general#/definitions/Number",
                "description": "The value to format.",
                "required": true,
                "bindable": true
            },
            {
                "name": "maxDecimals",
                "displayName": "maxDecimals",
                "type": "tchmi:general#/definitions/Number",
                "description": "How many decimal places the value should have.",
                "required": false,
                "bindable": true
            }
        ]
    },
    "dataTypes": []
}