{
    "$schema": "../TcHmiFramework/Schema/FunctionDescription.Schema.json",
    "apiVersion": 1,
    "version": {
        "full": "1.12.750.1",
        "major": 1,
        "minor": 12,
        "build": 750,
        "revision": 1
    },
    "dependencyFiles": [
        {
            "name": "GetTheme.js",
            "type": "JavaScript",
            "description": ""
        }
    ],
    "function": {
        "name": "GetTheme",
        "namespace": "TcHmi.Functions.Beckhoff",
        "displayName": "GetTheme",
        "description": "Gets the current Themename.",
        "category": "Theme",
        "returnValue": {
            "type": "tchmi:framework#/definitions/ThemeName"
        },
        "arguments": []
    }
}