{
    "$schema": "../TcHmiFramework/Schema/FunctionDescription.Schema.json",
    "apiVersion": 1,
    "version": {
        "full": "1.12.750.1",
        "major": 1,
        "minor": 12,
        "build": 750,
        "revision": 1
    },
    "dependencyFiles": [
        {
            "name": "GetElementByIndex.js",
            "type": "JavaScript",
            "description": ""
        }
    ],
    "function": {
        "name": "GetElementByIndex",
        "namespace": "TcHmi.Functions.Beckhoff",
        "displayName": "GetElementByIndex",
        "visible": true,
        "description": "Return the value at the array index position.",
        "category": "Data Conversion",
        "waitMode": "Asynchronous",
        "injectContextObject": true,
        "returnValue": null,
        "arguments": [
            {
                "name": "ctx",
                "displayName": "ctx",
                "type": "tchmi:framework#/definitions/ContextReference",
                "description": "Context Reference",
                "required": true,
                "bindable": false
            },
            {
                "name": "arraySymbol",
                "displayName": "arraySymbol",
                "type": "tchmi:framework#/definitions/Symbol",
                "description": "Value to be trimmed",
                "required": true,
                "bindable": true
            },
            {
                "name": "index",
                "displayName": "index",
                "type": "tchmi:framework#/definitions/PositiveNumber",
                "description": "Index",
                "required": true,
                "bindable": true
            }
        ]
    }
}