{
    "$schema": "../TcHmiFramework/Schema/FunctionDescription.Schema.json",
    "apiVersion": 1,
    "version": {
        "full": "1.12.750.1",
        "major": 1,
        "minor": 12,
        "build": 750,
        "revision": 1
    },
    "dependencyFiles": [
        {
            "name": "SetTheme.js",
            "type": "JavaScript",
            "description": ""
        }
    ],
    "function": {
        "name": "SetTheme",
        "namespace": "TcHmi.Functions.Beckhoff",
        "displayName": "SetTheme",
        "description": "Set a new Theme.",
        "category": "Theme",
        "returnValue": null,
        "arguments": [
            {
                "name": "newTheme",
                "displayName": "newTheme",
                "type": "tchmi:framework#/definitions/ThemeName",
                "description": "New theme name.",
                "required": true,
                "bindable": true
            }
        ]
    }
}