{
    "$schema": "../TcHmiFramework/Schema/FunctionDescription.Schema.json",
    "apiVersion": 1,
    "version": {
        "full": "1.12.750.1",
        "major": 1,
        "minor": 12,
        "build": 750,
        "revision": 1
    },
    "dependencyFiles": [
        {
            "name": "FormatString.js",
            "type": "JavaScript",
            "description": ""
        }
    ],
    "function": {
        "name": "FormatString",
        "namespace": "TcHmi.Functions.Beckhoff",
        "displayName": "FormatString",
        "visible": true,
        "description": "Format a string. Placeholder syntax in format string: '{' to begin placeholder, optional parameter-index with | as seperator, description and '}' to close the placeholder. Example: {0|.1f}",
        "category": "Formatting",
        "returnValue": {
            "type": "tchmi:general#/definitions/String"
        },
        "arguments": [
            {
                "name": "formatString",
                "displayName": "formatString",
                "type": "tchmi:general#/definitions/String",
                "description": "FormatString with placeholder to be formatted",
                "required": true,
                "bindable": true
            },
            {
                "name": "args",
                "displayName": "args",
                "type": "tchmi:general#/definitions/Any",
                "description": "Argument to format the placeholder in formatString",
                "required": true,
                "bindable": true,
                "restParameter": true
            }
        ]
    }
}