{
    "$schema": "../TcHmiFramework/Schema/FunctionDescription.Schema.json",
    "apiVersion": 1,
    "version": {
        "full": "1.12.750.1",
        "major": 1,
        "minor": 12,
        "build": 750,
        "revision": 1
    },
    "dependencyFiles": [
        {
            "name": "SetLocaleEx.js",
            "type": "JavaScript",
            "description": ""
        }
    ],
    "function": {
        "name": "SetLocaleEx",
        "namespace": "TcHmi.Functions.Beckhoff",
        "displayName": "SetLocaleEx",
        "visible": true,
        "category": "Locale",
        "waitMode": "Asynchronous",
        "injectContextObject": true,
        "description": "Sets the application locale. The function waits for loading of the language files.",
        "returnValue": null,
        "arguments": [
            {
                "name": "ctx",
                "displayName": "ctx",
                "type": "tchmi:framework#/definitions/ContextReference",
                "description": "Context Reference",
                "defaultValue": null,
                "required": true,
                "bindable": false
            },
            {
                "name": "locale",
                "displayName": "locale",
                "type": "tchmi:general#/definitions/ProjectLocale",
                "description": "Locale",
                "required": true,
                "bindable": true
            }
        ]
    }
}