{
    "$schema": "../TcHmiFramework/Schema/FunctionDescription.Schema.json",
    "apiVersion": 1,
    "version": {
        "full": "1.12.750.1",
        "major": 1,
        "minor": 12,
        "build": 750,
        "revision": 1
    },
    "dependencyFiles": [
        {
            "name": "ForceLogout.js",
            "type": "JavaScript",
            "description": ""
        }
    ],
    "function": {
        "name": "ForceLogout",
        "namespace": "TcHmi.Functions.Beckhoff",
        "displayName": "ForceLogout",
        "visible": true,
        "category": "UserManagement",
        "description": "Logout a different user or all from a TcHmiServer.\nThis function is deprecated. Its recommended to use ForceLogoutEx.",
        "returnValue": {
            "type": "tchmi:general#/definitions/Boolean",
            "description": "Returns a boolean if the logout was called."
        },
        "arguments": [
            {
                "name": "username",
                "displayName": "username",
                "type": "tchmi:general#/definitions/String",
                "description": "Username to logout. Logout all users if left empty.",
                "required": true,
                "bindable": true,
                "restParameter": false
            }
        ]
    }
}