{
    "$schema": "../TcHmiFramework/Schema/FunctionDescription.Schema.json",
    "apiVersion": 1,
    "version": {
        "full": "1.12.750.1",
        "major": 1,
        "minor": 12,
        "build": 750,
        "revision": 1
    },
    "dependencyFiles": [
        {
            "name": "ForceLogoutEx.js",
            "type": "JavaScript",
            "description": ""
        }
    ],
    "function": {
        "name": "ForceLogoutEx",
        "namespace": "TcHmi.Functions.Beckhoff",
        "displayName": "ForceLogoutEx",
        "visible": true,
        "category": "UserManagement",
        "waitMode": "Asynchronous",
        "injectContextObject": true,
        "description": "Logout a different user or all from a TcHmiServer",
        "returnValue": null,
        "arguments": [
            {
                "name": "ctx",
                "displayName": "ctx",
                "type": "tchmi:framework#/definitions/ContextReference",
                "description": "Context Reference",
                "defaultValue": null,
                "required": true,
                "bindable": false
            },
            {
                "name": "username",
                "displayName": "username",
                "type": "tchmi:general#/definitions/String",
                "description": "Username to logout. Logout all users if left empty.",
                "required": true,
                "bindable": true,
                "restParameter": false
            }
        ]
    }
}