{
    "$schema": "../TcHmiFramework/Schema/FunctionDescription.Schema.json",
    "apiVersion": 1,
    "version": {
        "full": "1.12.750.1",
        "major": 1,
        "minor": 12,
        "build": 750,
        "revision": 1
    },
    "dependencyFiles": [
        {
            "name": "TeachRecipe.js",
            "type": "JavaScript",
            "description": ""
        }
    ],
    "function": {
        "name": "TeachRecipe",
        "namespace": "TcHmi.Functions.Beckhoff",
        "displayName": "TeachRecipe",
        "visible": true,
        "category": "Recipe",
        "waitMode": "Asynchronous",
        "injectContextObject": true,
        "description": "Reads the current values which are referenced from a base recipe and write it into the same recipe.",
        "returnValue": null,
        "arguments": [
            {
                "name": "ctx",
                "displayName": "ctx",
                "type": "tchmi:framework#/definitions/ContextReference",
                "description": "Context Reference",
                "defaultValue": null,
                "required": true,
                "bindable": false
            },
            {
                "name": "recipeReference",
                "displayName": "recipeReference",
                "type": "tchmi:framework#/definitions/RecipeReference",
                "description": "Reference (path + '::' + name) of the recipe",
                "defaultValue": "",
                "required": true,
                "bindable": true
            }
        ]
    }
}