{
    "$schema": "../TcHmiFramework/Schema/FunctionDescription.Schema.json",
    "apiVersion": 1,
    "version": {
        "full": "1.12.750.1",
        "major": 1,
        "minor": 12,
        "build": 750,
        "revision": 1
    },
    "dependencyFiles": [
        {
            "name": "GetRegisteredLocales.js",
            "type": "JavaScript",
            "description": ""
        }
    ],
    "function": {
        "name": "GetRegisteredLocales",
        "namespace": "TcHmi.Functions.Beckhoff",
        "displayName": "GetRegisteredLocales",
        "visible": true,
        "category": "Locale",
        "description": "Returns the list of registered locales as array of string.",
        "returnValue": {
            "type": "tchmi:general#/definitions/Array"
        },
        "arguments": []
    }
}